{
  "schema_version": 1,
  "input_fingerprint_version": 2,
  "family": "playwright-browser",
  "purpose": "Version-matched Chromium, Firefox and WebKit browser server without PHP or development build tools.",
  "capabilities": [
    "playwright",
    "chromium",
    "firefox",
    "webkit",
    "browser-server",
    "node"
  ],
  "extensions": [],
  "tools": [
    "node",
    "playwright"
  ],
  "execution": {
    "workspace": "/workspace",
    "home": "/home/dev",
    "default_uid": 1000,
    "default_gid": 1000,
    "uid_env": "PUID",
    "gid_env": "PGID",
    "cache_paths": [
      "/home/dev/.cache"
    ]
  },
  "companions": [],
  "limitations": [
    "Use the exact Playwright version pinned by the consuming project.",
    "Linux/amd64 only. All three engines are included; size savings are measured during validation and publication."
  ],
  "lines": {
    "1.58-trixie": {
      "runtime_line": "1.58",
      "os": "debian-trixie",
      "revision": "1.0.0",
      "platforms": [
        "linux/amd64"
      ],
      "base": {
        "tag": "docker.io/library/node:22-trixie-slim",
        "digest": "sha256:154ba2f4d6fec323d28e4f4bb86bba4677f1223391a1979cf521304e03a98dfa"
      },
      "changes": [
        "Prepare Playwright 1.58.2 and its Chromium, Firefox and WebKit engines; verify each engine offline before catalog availability."
      ],
      "migration": "New optional companion. The runner retains the official image for versions without an accepted xorder browser release. BROWSER_IMAGE explicitly selects a local candidate or verified digest."
    }
  }
}
