{
  "purpose": "Python development with uv, pip, venv, native compilation and PostgreSQL clients.",
  "capabilities": [
    "python",
    "uv",
    "pip",
    "venv",
    "native-build",
    "postgresql-client"
  ],
  "extensions": [],
  "limitations": [
    "Install project dependencies from uv.lock, requirements files, or the project manifest.",
    "Compatibility with a particular project must include its dependencies, not only requires-python."
  ],
  "schema_version": 1,
  "family": "python-dev",
  "tools": [
    "bash",
    "git",
    "gh",
    "curl",
    "jq",
    "rg",
    "psql"
  ],
  "execution": {
    "workspace": "/workspace",
    "home": "/home/dev",
    "default_uid": 1000,
    "default_gid": 1000,
    "uid_env": "PUID",
    "gid_env": "PGID",
    "cache_paths": [
      "/home/dev/.cache"
    ]
  },
  "companions": [
    "postgres:17-trixie"
  ],
  "lines": {
    "3.14-trixie": {
      "runtime_line": "3.14",
      "os": "debian-trixie",
      "revision": "1.0.1",
      "platforms": [
        "linux/amd64"
      ],
      "base": {
        "tag": "docker.io/library/python:3.14-slim-trixie",
        "digest": "sha256:f85c5697265c178cc6887276c55fe16cf3d14ca35c3df6a5eab3b360534a55d2"
      },
      "changes": [
        "Reuse build layers across source-label changes; explicitly refresh Debian packages for each image revision.",
        "Use the official slim Trixie base with explicitly installed native build tools and PostgreSQL clients.",
        "Reuse the upstream Python interpreter instead of installing a second system Python."
      ],
      "migration": "Compatible patch update; advertised development capabilities and invocation remain unchanged. Verify project dependencies before changing an existing digest pin."
    }
  }
}
